{
  "campaign_key": "posthire_hovenier",
  "dienst_naam": "hovenier",
  "chosen_subject": "🎉 Gefeliciteerd met je hovenier",
  "chosen_preheader": "Mooi gedaan. Drie tips voor een goede start en wat je daarna misschien ook wilt regelen.",
  "chosen_subtitle": "Fijn dat het gelukt is via Trustoo. Komt er nog meer bij kijken? Na een hovenier vragen mensen vaak ook een stratenmaker of boomverzorger aan. Gratis en vrijblijvend.",
  "related_intro": "Dit vragen mensen na een hovenier vaak ook aan.",
  "r1_name": "Stratenmaker",
  "r1_label": "Vóór de beplanting",
  "r1_price": "€ 40 – € 100 per m²",
  "r1_url": "https://trustoo.nl/nederland/stratenmaker/?utm_source=brevo&utm_medium=email&utm_campaign=posthire_hovenier&utm_content=gerelateerd1",
  "r1_style": "",
  "r2_name": "Boomverzorger",
  "r2_label": "Voor gezonde bomen",
  "r2_price": "Prijs op maat",
  "r2_url": "https://trustoo.nl/nederland/boomverzorging/?utm_source=brevo&utm_medium=email&utm_campaign=posthire_hovenier&utm_content=gerelateerd2",
  "r2_style": "",
  "r3_name": "Klusjesman",
  "r3_label": "Voor andere klussen",
  "r3_price": "€ 30 – € 55 per uur",
  "r3_url": "https://trustoo.nl/nederland/klusjesman/?utm_source=brevo&utm_medium=email&utm_campaign=posthire_hovenier&utm_content=gerelateerd3",
  "r3_style": "",
  "r4_name": "Hekwerkspecialist",
  "r4_label": "Voor privacy",
  "r4_price": "€ 65 – € 250 per meter",
  "r4_url": "https://trustoo.nl/nederland/hekwerk/?utm_source=brevo&utm_medium=email&utm_campaign=posthire_hovenier&utm_content=gerelateerd4",
  "r4_style": "",
  "popular1_name": "Rijschool",
  "popular1_url": "https://trustoo.nl/nederland/rijschool/?utm_source=brevo&utm_medium=email&utm_campaign=posthire_hovenier&utm_content=populair1",
  "popular2_name": "Schoonmaakbedrijf",
  "popular2_url": "https://trustoo.nl/nederland/schoonmaakbedrijf/?utm_source=brevo&utm_medium=email&utm_campaign=posthire_hovenier&utm_content=populair2",
  "popular3_name": "Notaris",
  "popular3_url": "https://trustoo.nl/nederland/notaris/?utm_source=brevo&utm_medium=email&utm_campaign=posthire_hovenier&utm_content=populair3",
  "popular4_name": "Schilder",
  "popular4_url": "https://trustoo.nl/nederland/schilder/?utm_source=brevo&utm_medium=email&utm_campaign=posthire_hovenier&utm_content=populair4",
  "popular_style": ""
}
