{
  "campaign_key": "posthire_verkoopmakelaar",
  "dienst_naam": "verkoopmakelaar",
  "chosen_subject": "🎉 Gefeliciteerd met je verkoopmakelaar",
  "chosen_preheader": "Mooi gedaan. Drie tips voor een goede start en wat je daarna misschien ook wilt regelen.",
  "chosen_subtitle": "Fijn dat het gelukt is via Trustoo. Komt er nog meer bij kijken? Na een verkoopmakelaar vragen mensen vaak ook een taxateur of bouwkundig keurder aan. Gratis en vrijblijvend.",
  "related_intro": "Dit vragen mensen na een verkoopmakelaar vaak ook aan.",
  "r1_name": "Taxateur",
  "r1_label": "Voor de waarde bij verkoop",
  "r1_price": "€ 500 – € 1.000",
  "r1_url": "https://trustoo.nl/nederland/taxateur/?utm_source=brevo&utm_medium=email&utm_campaign=posthire_verkoopmakelaar&utm_content=gerelateerd1",
  "r1_style": "",
  "r2_name": "Bouwkundig keurder",
  "r2_label": "Voor zekerheid vooraf",
  "r2_price": "€ 350 – € 500",
  "r2_url": "https://trustoo.nl/nederland/bouwkundige-keuring/?utm_source=brevo&utm_medium=email&utm_campaign=posthire_verkoopmakelaar&utm_content=gerelateerd2",
  "r2_style": "",
  "r3_name": "Notaris",
  "r3_label": "Voor aktes en contracten",
  "r3_price": "€ 200 – € 800 per akte",
  "r3_url": "https://trustoo.nl/nederland/notaris/?utm_source=brevo&utm_medium=email&utm_campaign=posthire_verkoopmakelaar&utm_content=gerelateerd3",
  "r3_style": "",
  "r4_name": "",
  "r4_label": "",
  "r4_price": "",
  "r4_url": "https://trustoo.nl/",
  "r4_style": "display:none; mso-hide:all;",
  "popular1_name": "Rijschool",
  "popular1_url": "https://trustoo.nl/nederland/rijschool/?utm_source=brevo&utm_medium=email&utm_campaign=posthire_verkoopmakelaar&utm_content=populair1",
  "popular2_name": "Schoonmaakbedrijf",
  "popular2_url": "https://trustoo.nl/nederland/schoonmaakbedrijf/?utm_source=brevo&utm_medium=email&utm_campaign=posthire_verkoopmakelaar&utm_content=populair2",
  "popular3_name": "Schilder",
  "popular3_url": "https://trustoo.nl/nederland/schilder/?utm_source=brevo&utm_medium=email&utm_campaign=posthire_verkoopmakelaar&utm_content=populair3",
  "popular4_name": "Advocaat",
  "popular4_url": "https://trustoo.nl/nederland/advocaat/?utm_source=brevo&utm_medium=email&utm_campaign=posthire_verkoopmakelaar&utm_content=populair4",
  "popular_style": ""
}
