{
  "campaign_key": "posthire_badkamer-renovatie",
  "dienst_naam": "badkamerinstallateur",
  "chosen_subject": "🎉 Gefeliciteerd met je badkamerinstallateur",
  "chosen_preheader": "Mooi gedaan. Drie tips voor een goede start en wat je daarna misschien ook wilt regelen.",
  "chosen_subtitle": "Fijn dat het gelukt is via Trustoo. Komt er nog meer bij kijken? Na een badkamerinstallateur vragen mensen vaak ook een loodgieter of elektricien aan. Gratis en vrijblijvend.",
  "related_intro": "Dit vragen mensen na een badkamerinstallateur vaak ook aan.",
  "r1_name": "Loodgieter",
  "r1_label": "Voor water en afvoer",
  "r1_price": "€ 40 – € 80 per uur",
  "r1_url": "https://trustoo.nl/nederland/loodgieter/?utm_source=brevo&utm_medium=email&utm_campaign=posthire_badkamer-renovatie&utm_content=gerelateerd1",
  "r1_style": "",
  "r2_name": "Elektricien",
  "r2_label": "Voor stroom en verlichting",
  "r2_price": "€ 35 – € 70 per uur",
  "r2_url": "https://trustoo.nl/nederland/elektricien/?utm_source=brevo&utm_medium=email&utm_campaign=posthire_badkamer-renovatie&utm_content=gerelateerd2",
  "r2_style": "",
  "r3_name": "Tegelzetter",
  "r3_label": "Voor tegelwerk",
  "r3_price": "€ 25 – € 40 per m²",
  "r3_url": "https://trustoo.nl/nederland/tegelzetter/?utm_source=brevo&utm_medium=email&utm_campaign=posthire_badkamer-renovatie&utm_content=gerelateerd3",
  "r3_style": "",
  "r4_name": "Stukadoor",
  "r4_label": "Voor strakke muren",
  "r4_price": "€ 15 – € 25 per m²",
  "r4_url": "https://trustoo.nl/nederland/stukadoor/?utm_source=brevo&utm_medium=email&utm_campaign=posthire_badkamer-renovatie&utm_content=gerelateerd4",
  "r4_style": "",
  "popular1_name": "Rijschool",
  "popular1_url": "https://trustoo.nl/nederland/rijschool/?utm_source=brevo&utm_medium=email&utm_campaign=posthire_badkamer-renovatie&utm_content=populair1",
  "popular2_name": "Schoonmaakbedrijf",
  "popular2_url": "https://trustoo.nl/nederland/schoonmaakbedrijf/?utm_source=brevo&utm_medium=email&utm_campaign=posthire_badkamer-renovatie&utm_content=populair2",
  "popular3_name": "Notaris",
  "popular3_url": "https://trustoo.nl/nederland/notaris/?utm_source=brevo&utm_medium=email&utm_campaign=posthire_badkamer-renovatie&utm_content=populair3",
  "popular4_name": "Schilder",
  "popular4_url": "https://trustoo.nl/nederland/schilder/?utm_source=brevo&utm_medium=email&utm_campaign=posthire_badkamer-renovatie&utm_content=populair4",
  "popular_style": ""
}
