{
  "campaign_key": "posthire_stoffeerder",
  "dienst_naam": "stoffeerder",
  "chosen_subject": "🎉 Gefeliciteerd met je stoffeerder",
  "chosen_preheader": "Mooi gedaan. Drie tips voor een goede start en wat je daarna misschien ook wilt regelen.",
  "chosen_subtitle": "Fijn dat het gelukt is via Trustoo. Komt er nog meer bij kijken? Na een stoffeerder vragen mensen vaak ook een vloerlegger of interieurstylist aan. Gratis en vrijblijvend.",
  "related_intro": "Dit vragen mensen na een stoffeerder vaak ook aan.",
  "r1_name": "Vloerlegger",
  "r1_label": "Voor een nieuwe vloer",
  "r1_price": "€ 25 – € 75 per m²",
  "r1_url": "https://trustoo.nl/nederland/vloerlegger/?utm_source=brevo&utm_medium=email&utm_campaign=posthire_stoffeerder&utm_content=gerelateerd1",
  "r1_style": "",
  "r2_name": "Interieurstylist",
  "r2_label": "Voor je interieur",
  "r2_price": "Prijs op maat",
  "r2_url": "https://trustoo.nl/nederland/interieurstylist/?utm_source=brevo&utm_medium=email&utm_campaign=posthire_stoffeerder&utm_content=gerelateerd2",
  "r2_style": "",
  "r3_name": "Schoonmaakbedrijf",
  "r3_label": "Voor een schoon huis",
  "r3_price": "€ 20 – € 30 per uur",
  "r3_url": "https://trustoo.nl/nederland/schoonmaakbedrijf/?utm_source=brevo&utm_medium=email&utm_campaign=posthire_stoffeerder&utm_content=gerelateerd3",
  "r3_style": "",
  "r4_name": "Meubelmaker",
  "r4_label": "Voor maatmeubels",
  "r4_price": "Prijs op maat",
  "r4_url": "https://trustoo.nl/nederland/meubelmaker/?utm_source=brevo&utm_medium=email&utm_campaign=posthire_stoffeerder&utm_content=gerelateerd4",
  "r4_style": "",
  "popular1_name": "Rijschool",
  "popular1_url": "https://trustoo.nl/nederland/rijschool/?utm_source=brevo&utm_medium=email&utm_campaign=posthire_stoffeerder&utm_content=populair1",
  "popular2_name": "Notaris",
  "popular2_url": "https://trustoo.nl/nederland/notaris/?utm_source=brevo&utm_medium=email&utm_campaign=posthire_stoffeerder&utm_content=populair2",
  "popular3_name": "Schilder",
  "popular3_url": "https://trustoo.nl/nederland/schilder/?utm_source=brevo&utm_medium=email&utm_campaign=posthire_stoffeerder&utm_content=populair3",
  "popular4_name": "Advocaat",
  "popular4_url": "https://trustoo.nl/nederland/advocaat/?utm_source=brevo&utm_medium=email&utm_campaign=posthire_stoffeerder&utm_content=populair4",
  "popular_style": ""
}
