{
  "campaign_key": "posthire_koffieautomaat",
  "dienst_naam": "koffieautomaat­leverancier",
  "chosen_subject": "🎉 Gefeliciteerd met je koffieautomaatleverancier",
  "chosen_preheader": "Mooi gedaan. Drie tips voor een goede start en wat je daarna misschien ook wilt regelen.",
  "chosen_subtitle": "Fijn dat het gelukt is via Trustoo. Komt er nog meer bij kijken? Na een koffieautomaatleverancier vragen mensen vaak ook een schoonmaakbedrijf of cateraar aan. Gratis en vrijblijvend.",
  "related_intro": "Dit vragen mensen na een koffieautomaatleverancier vaak ook aan.",
  "r1_name": "Schoonmaakbedrijf",
  "r1_label": "Voor een schone werkplek",
  "r1_price": "€ 20 – € 30 per uur",
  "r1_url": "https://trustoo.nl/nederland/schoonmaakbedrijf/?utm_source=brevo&utm_medium=email&utm_campaign=posthire_koffieautomaat&utm_content=gerelateerd1",
  "r1_style": "",
  "r2_name": "Cateraar",
  "r2_label": "Voor eten en drinken",
  "r2_price": "€ 15,50 – € 22 p.p.",
  "r2_url": "https://trustoo.nl/nederland/catering/?utm_source=brevo&utm_medium=email&utm_campaign=posthire_koffieautomaat&utm_content=gerelateerd2",
  "r2_style": "",
  "r3_name": "Alarmsysteem",
  "r3_label": "Voor een veilig pand",
  "r3_price": "Prijs op maat",
  "r3_url": "https://trustoo.nl/nederland/alarmsystemen/?utm_source=brevo&utm_medium=email&utm_campaign=posthire_koffieautomaat&utm_content=gerelateerd3",
  "r3_style": "",
  "r4_name": "Klusjesman",
  "r4_label": "Voor andere klussen",
  "r4_price": "€ 30 – € 55 per uur",
  "r4_url": "https://trustoo.nl/nederland/klusjesman/?utm_source=brevo&utm_medium=email&utm_campaign=posthire_koffieautomaat&utm_content=gerelateerd4",
  "r4_style": "",
  "popular1_name": "Rijschool",
  "popular1_url": "https://trustoo.nl/nederland/rijschool/?utm_source=brevo&utm_medium=email&utm_campaign=posthire_koffieautomaat&utm_content=populair1",
  "popular2_name": "Notaris",
  "popular2_url": "https://trustoo.nl/nederland/notaris/?utm_source=brevo&utm_medium=email&utm_campaign=posthire_koffieautomaat&utm_content=populair2",
  "popular3_name": "Schilder",
  "popular3_url": "https://trustoo.nl/nederland/schilder/?utm_source=brevo&utm_medium=email&utm_campaign=posthire_koffieautomaat&utm_content=populair3",
  "popular4_name": "Advocaat",
  "popular4_url": "https://trustoo.nl/nederland/advocaat/?utm_source=brevo&utm_medium=email&utm_campaign=posthire_koffieautomaat&utm_content=populair4",
  "popular_style": ""
}
