{
  "campaign_key": "posthire_alarmsystemen",
  "dienst_naam": "alarmsysteembedrijf",
  "chosen_subject": "🎉 Gefeliciteerd met je alarmsysteembedrijf",
  "chosen_preheader": "Mooi gedaan. Drie tips voor een goede start en wat je daarna misschien ook wilt regelen.",
  "chosen_subtitle": "Fijn dat het gelukt is via Trustoo. Komt er nog meer bij kijken? Na een alarmsysteembedrijf vragen mensen vaak ook een beveiligingsbedrijf of elektricien aan. Gratis en vrijblijvend.",
  "related_intro": "Dit vragen mensen na een alarmsysteembedrijf vaak ook aan.",
  "r1_name": "Beveiligingsbedrijf",
  "r1_label": "Voor extra veiligheid",
  "r1_price": "€ 35 – € 50 per uur",
  "r1_url": "https://trustoo.nl/nederland/beveiliging/?utm_source=brevo&utm_medium=email&utm_campaign=posthire_alarmsystemen&utm_content=gerelateerd1",
  "r1_style": "",
  "r2_name": "Elektricien",
  "r2_label": "Voor stroom en verlichting",
  "r2_price": "€ 35 – € 70 per uur",
  "r2_url": "https://trustoo.nl/nederland/elektricien/?utm_source=brevo&utm_medium=email&utm_campaign=posthire_alarmsystemen&utm_content=gerelateerd2",
  "r2_style": "",
  "r3_name": "Schoonmaakbedrijf",
  "r3_label": "Voor een schoon pand",
  "r3_price": "€ 20 – € 30 per uur",
  "r3_url": "https://trustoo.nl/nederland/schoonmaakbedrijf/?utm_source=brevo&utm_medium=email&utm_campaign=posthire_alarmsystemen&utm_content=gerelateerd3",
  "r3_style": "display:none; mso-hide:all;",
  "r4_name": "",
  "r4_label": "",
  "r4_price": "",
  "r4_url": "https://trustoo.nl/",
  "r4_style": "display:none; mso-hide:all;",
  "popular1_name": "Rijschool",
  "popular1_url": "https://trustoo.nl/nederland/rijschool/?utm_source=brevo&utm_medium=email&utm_campaign=posthire_alarmsystemen&utm_content=populair1",
  "popular2_name": "Schoonmaakbedrijf",
  "popular2_url": "https://trustoo.nl/nederland/schoonmaakbedrijf/?utm_source=brevo&utm_medium=email&utm_campaign=posthire_alarmsystemen&utm_content=populair2",
  "popular3_name": "Notaris",
  "popular3_url": "https://trustoo.nl/nederland/notaris/?utm_source=brevo&utm_medium=email&utm_campaign=posthire_alarmsystemen&utm_content=populair3",
  "popular4_name": "Schilder",
  "popular4_url": "https://trustoo.nl/nederland/schilder/?utm_source=brevo&utm_medium=email&utm_campaign=posthire_alarmsystemen&utm_content=populair4",
  "popular_style": ""
}
