{
  "campaign_key": "posthire_weddingplanner",
  "dienst_naam": "weddingplanner",
  "chosen_subject": "🎉 Gefeliciteerd met je weddingplanner",
  "chosen_preheader": "Mooi gedaan. Drie tips voor een goede start en wat je daarna misschien ook wilt regelen.",
  "chosen_subtitle": "Fijn dat het gelukt is via Trustoo. Komt er nog meer bij kijken? Na een weddingplanner vragen mensen vaak ook een trouwfotograaf of dj aan. Gratis en vrijblijvend.",
  "related_intro": "Dit vragen mensen na een weddingplanner vaak ook aan.",
  "r1_name": "Trouwfotograaf",
  "r1_label": "Voor je trouwfoto's",
  "r1_price": "6 uur: € 850 – € 2.000",
  "r1_url": "https://trustoo.nl/nederland/trouwfotograaf/?utm_source=brevo&utm_medium=email&utm_campaign=posthire_weddingplanner&utm_content=gerelateerd1",
  "r1_style": "",
  "r2_name": "Dj",
  "r2_label": "Voor de muziek",
  "r2_price": "€ 125 – € 200 per uur",
  "r2_url": "https://trustoo.nl/nederland/dj/?utm_source=brevo&utm_medium=email&utm_campaign=posthire_weddingplanner&utm_content=gerelateerd2",
  "r2_style": "",
  "r3_name": "Cateraar",
  "r3_label": "Voor eten en drinken",
  "r3_price": "Bruiloft: € 25 – € 40 p.p.",
  "r3_url": "https://trustoo.nl/nederland/catering/?utm_source=brevo&utm_medium=email&utm_campaign=posthire_weddingplanner&utm_content=gerelateerd3",
  "r3_style": "",
  "r4_name": "Videograaf",
  "r4_label": "Voor een film",
  "r4_price": "Prijs op maat",
  "r4_url": "https://trustoo.nl/nederland/videograaf/?utm_source=brevo&utm_medium=email&utm_campaign=posthire_weddingplanner&utm_content=gerelateerd4",
  "r4_style": "",
  "popular1_name": "Rijschool",
  "popular1_url": "https://trustoo.nl/nederland/rijschool/?utm_source=brevo&utm_medium=email&utm_campaign=posthire_weddingplanner&utm_content=populair1",
  "popular2_name": "Schoonmaakbedrijf",
  "popular2_url": "https://trustoo.nl/nederland/schoonmaakbedrijf/?utm_source=brevo&utm_medium=email&utm_campaign=posthire_weddingplanner&utm_content=populair2",
  "popular3_name": "Notaris",
  "popular3_url": "https://trustoo.nl/nederland/notaris/?utm_source=brevo&utm_medium=email&utm_campaign=posthire_weddingplanner&utm_content=populair3",
  "popular4_name": "Schilder",
  "popular4_url": "https://trustoo.nl/nederland/schilder/?utm_source=brevo&utm_medium=email&utm_campaign=posthire_weddingplanner&utm_content=populair4",
  "popular_style": ""
}
