{
  "campaign_key": "posthire_vloerlegger",
  "dienst_naam": "vloerlegger",
  "chosen_subject": "🎉 Gefeliciteerd met je vloerlegger",
  "chosen_preheader": "Mooi gedaan. Drie tips voor een goede start en wat je daarna misschien ook wilt regelen.",
  "chosen_subtitle": "Fijn dat het gelukt is via Trustoo. Komt er nog meer bij kijken? Na een vloerlegger vragen mensen vaak ook een stukadoor of schilder aan. Gratis en vrijblijvend.",
  "related_intro": "Dit vragen mensen na een vloerlegger vaak ook aan.",
  "r1_name": "Stukadoor",
  "r1_label": "Voor strakke muren",
  "r1_price": "€ 15 – € 25 per m²",
  "r1_url": "https://trustoo.nl/nederland/stukadoor/?utm_source=brevo&utm_medium=email&utm_campaign=posthire_vloerlegger&utm_content=gerelateerd1",
  "r1_style": "",
  "r2_name": "Schilder",
  "r2_label": "Voor binnen en buiten",
  "r2_price": "€ 35 – € 50 per uur",
  "r2_url": "https://trustoo.nl/nederland/schilder/?utm_source=brevo&utm_medium=email&utm_campaign=posthire_vloerlegger&utm_content=gerelateerd2",
  "r2_style": "",
  "r3_name": "Stoffeerder",
  "r3_label": "Voor stoffering",
  "r3_price": "Prijs op maat",
  "r3_url": "https://trustoo.nl/nederland/stoffeerder/?utm_source=brevo&utm_medium=email&utm_campaign=posthire_vloerlegger&utm_content=gerelateerd3",
  "r3_style": "",
  "r4_name": "Tegelzetter",
  "r4_label": "Voor tegelwerk",
  "r4_price": "€ 25 – € 40 per m²",
  "r4_url": "https://trustoo.nl/nederland/tegelzetter/?utm_source=brevo&utm_medium=email&utm_campaign=posthire_vloerlegger&utm_content=gerelateerd4",
  "r4_style": "",
  "popular1_name": "Rijschool",
  "popular1_url": "https://trustoo.nl/nederland/rijschool/?utm_source=brevo&utm_medium=email&utm_campaign=posthire_vloerlegger&utm_content=populair1",
  "popular2_name": "Schoonmaakbedrijf",
  "popular2_url": "https://trustoo.nl/nederland/schoonmaakbedrijf/?utm_source=brevo&utm_medium=email&utm_campaign=posthire_vloerlegger&utm_content=populair2",
  "popular3_name": "Notaris",
  "popular3_url": "https://trustoo.nl/nederland/notaris/?utm_source=brevo&utm_medium=email&utm_campaign=posthire_vloerlegger&utm_content=populair3",
  "popular4_name": "Advocaat",
  "popular4_url": "https://trustoo.nl/nederland/advocaat/?utm_source=brevo&utm_medium=email&utm_campaign=posthire_vloerlegger&utm_content=populair4",
  "popular_style": ""
}
