{
  "campaign_key": "posthire_loopbaancoach",
  "dienst_naam": "loopbaancoach",
  "chosen_subject": "🎉 Gefeliciteerd met je loopbaancoach",
  "chosen_preheader": "Mooi gedaan. Drie tips voor een goede start en wat je daarna misschien ook wilt regelen.",
  "chosen_subtitle": "Fijn dat het gelukt is via Trustoo. Komt er nog meer bij kijken? Na een loopbaancoach vragen mensen vaak ook een psycholoog of financieel adviseur aan. Gratis en vrijblijvend.",
  "related_intro": "Dit vragen mensen na een loopbaancoach vaak ook aan.",
  "r1_name": "Psycholoog",
  "r1_label": "Voor een luisterend oor",
  "r1_price": "€ 100 – € 150 per uur",
  "r1_url": "https://trustoo.nl/nederland/psycholoog/?utm_source=brevo&utm_medium=email&utm_campaign=posthire_loopbaancoach&utm_content=gerelateerd1",
  "r1_style": "",
  "r2_name": "Rijschool",
  "r2_label": "Voor je rijbewijs",
  "r2_price": "€ 45 – € 65 per uur",
  "r2_url": "https://trustoo.nl/nederland/rijschool/?utm_source=brevo&utm_medium=email&utm_campaign=posthire_loopbaancoach&utm_content=gerelateerd2",
  "r2_style": "display:none; mso-hide:all;",
  "r3_name": "Financieel adviseur",
  "r3_label": "Voor financieel advies",
  "r3_price": "Prijs op maat",
  "r3_url": "https://trustoo.nl/nederland/financieel-adviseur/?utm_source=brevo&utm_medium=email&utm_campaign=posthire_loopbaancoach&utm_content=gerelateerd3",
  "r3_style": "",
  "r4_name": "",
  "r4_label": "",
  "r4_price": "",
  "r4_url": "https://trustoo.nl/",
  "r4_style": "display:none; mso-hide:all;",
  "popular1_name": "Rijschool",
  "popular1_url": "https://trustoo.nl/nederland/rijschool/?utm_source=brevo&utm_medium=email&utm_campaign=posthire_loopbaancoach&utm_content=populair1",
  "popular2_name": "Schoonmaakbedrijf",
  "popular2_url": "https://trustoo.nl/nederland/schoonmaakbedrijf/?utm_source=brevo&utm_medium=email&utm_campaign=posthire_loopbaancoach&utm_content=populair2",
  "popular3_name": "Notaris",
  "popular3_url": "https://trustoo.nl/nederland/notaris/?utm_source=brevo&utm_medium=email&utm_campaign=posthire_loopbaancoach&utm_content=populair3",
  "popular4_name": "Schilder",
  "popular4_url": "https://trustoo.nl/nederland/schilder/?utm_source=brevo&utm_medium=email&utm_campaign=posthire_loopbaancoach&utm_content=populair4",
  "popular_style": ""
}
